{
  "$schema": "https://json-schema.org/draft/2020-12/schema",
  "$id": "https://pano.local/schemas/artifact-manifest/0.1.0",
  "title": "ArtifactManifest",
  "type": "object",
  "additionalProperties": false,
  "required": [
    "schemaVersion",
    "id",
    "projectId",
    "artifactType",
    "contentHash",
    "byteLength",
    "contentType",
    "generator",
    "inputDigests",
    "createdAt"
  ],
  "properties": {
    "schemaVersion": { "const": "0.1.0" },
    "id": { "type": "string", "minLength": 1, "maxLength": 256 },
    "projectId": { "type": "string", "minLength": 1, "maxLength": 128 },
    "artifactType": {
      "enum": [
        "layoutRevision",
        "layoutSolution",
        "cameraPlan",
        "sceneManifest",
        "panoramaReference",
        "panoramaResult",
        "panoManifest",
        "controlMapSet",
        "cubemapSet",
        "qualityReport"
      ]
    },
    "contentHash": { "type": "string", "pattern": "^[a-f0-9]{64}$" },
    "byteLength": { "type": "integer", "minimum": 0 },
    "contentType": { "type": "string", "minLength": 1, "maxLength": 128 },
    "generator": {
      "type": "object",
      "additionalProperties": false,
      "required": ["name", "version"],
      "properties": {
        "name": { "type": "string", "minLength": 1 },
        "version": { "type": "string", "minLength": 1 }
      }
    },
    "inputDigests": {
      "type": "array",
      "items": { "type": "string", "pattern": "^[a-f0-9]{64}$" },
      "uniqueItems": true
    },
    "createdAt": { "type": "string", "format": "date-time" },
    "metadata": { "type": "object" }
  }
}
