{
  "schemaVersion": "0.1.0",
  "id": "artifact:fp001:panorama-reference:living-main:2048x1024",
  "projectId": "fp001",
  "artifactType": "panoramaReference",
  "contentHash": "3c982848ef188a6914829f0f787aaf6816f85b1b0f0314885223ea446bc5580b",
  "byteLength": 166103,
  "contentType": "image/png",
  "generator": {
    "name": "opencv-cubemap-to-erp",
    "version": "0.1.0"
  },
  "inputDigests": [
    "a2c530078f7c61e647c7252ddcbb7b22000859f12d95869b4ddc6748985c9bec"
  ],
  "createdAt": "2026-08-25T04:31:00.729000Z",
  "metadata": {
    "schemaVersion": "0.1.0",
    "projectId": "fp001",
    "scene": "living-main",
    "renderPass": "rgb",
    "projection": "equirectangular",
    "file": "living-main-erp-2048x1024.png",
    "width": 2048,
    "height": 1024,
    "byteLength": 166103,
    "sha256": "3c982848ef188a6914829f0f787aaf6816f85b1b0f0314885223ea446bc5580b",
    "seamMae": 0.0488,
    "cubemapIndex": "cubemap/cubemap.index.json",
    "captureProfile": {
      "schemaVersion": "0.1.0",
      "requestedResolution": 1024,
      "actualCubeFaceSize": 1024,
      "actualErpWidth": 2048,
      "actualErpHeight": 1024,
      "method": "sixFaceWebglCpuErp",
      "supersampleScale": 1,
      "maxCubeMapTextureSize": null,
      "maxRenderbufferSize": null,
      "allocationProbe": "notRun",
      "pixelReadbackProbe": "notRun",
      "resizeReasonCode": null
    }
  }
}